sentence,is_humor
U.S. justices skeptical of sex offender social media ban,0
Happy New year America! from your friend Australia. Don't worry I expect it'll take about 18 or so hours for you to get this.,1
"TV is the best girlfriend Because, no matter what happens, I can always turn it on.",1
What do you get if you cross an owl with a donkey? A Wise Ass.,1
Meet the man who’s been with the Nets for 50 years,0
I couldn't use my phone at the funeral home it was a dead zone.,1
So I took some acid and ate an entire box of Fiber bars. I've been seeing shit for days.,1
"My boss told me, ""Dress for the job you want, not the job you have."". I'm currently sitting in a disciplinary meeting wearing my batman costume!",1
Why is it so cold in San Francisco? Giant fans.,1
"nurse: ""if youre going to give grapes to a baby make sure you cut them in half"" me: [visibly confused] wife: ""the grapes keith not the baby""",1
The verdict is in — Bill Cosby’s legacy has been damaged beyond repair,0
You can stop asking writers who inspired them — all of the answers are now in one place,0
"Watching the basketball game with my dad... Me: Do you think Irving will score a three pointer in the last couple minutes? Dad: I don't know, that's quite a long shot.",1
REAL '90s kids will recognize this! ---> Current unemployment.,1
TIFU by not having a picture of my pet ready on my cake day. What were you expecting to see here?,1
Pop-up shoppers of the world unite as Morrissey store opens in New York,0
"What did Peter Pan say during the plane crash? ""It looks like we're going to Neverland.""",1
What' the difference between Adolf Hitler and Lance Armstrong? Lance Armstrong can finish a race!,1
Robert Downey Jr. buys wacky Hamptons house with windmill,0
Obama’s Low-Trust America,0
Grand mansion from ‘The Big Chill’ finally sells,0
Have you ever woken up because of a boner? Alarm cock.,1
‘Rude Boy’ wrestler busted for kiddie porn,0
"I failed my Health and Safety Test today apparently when they ask what steps you should take in case of a fire, large ones was not the correct answer",1
Forbes Mag: Iran Cool Destination for 2017 - Visitors Must Adapt to Sharia,0
"If women had to cum to make a baby , I'd never wear a condom! That on original . Your welcome",1
"Q: What is Irish and stays on your patio, even when it rains? A: Patty O'Furniture.",1
 Michigan Congressman Accuses Republicans Of Racism Over Flint Aid,0
Grammy Awards: Beyoncé Leads Noms with BLM-Inspired ’Lemonade’,0
Liz Mair Debates Ann Coulter On Trump: ’You Are In No Way Conservative’,0
What does a horny assassin do? Netflix and Kill.,1
dddddddddd ddddddddd dddddddddd ddd ddddddd ddddd dddd Sorry my keyboard was broken. I fixed it by giving my keyboard some Prozac because it was d-pressed.,1
Alabama top justice tells judges not to issue gay marriage licenses,0
"*Throws up some gang signs* *stabs self in eye with salad fork* Hubs: Next time you do the Macarena, put your fork down.",1
How do you make a 5yr old cry twice? When you rub your dick on her teddy bear.,1
Airstrikes by Russia Buttress Turkey in Battle vs. ISIS - The New York Times,0
I have a friend that's addicted to brake fluid. But he says he can stop anytime.,1
What did one mushroom say to the other as he passed him on the street? Porta-hello,1
"A priest and a rabbi are sitting in a park watching some kids play. The priest turns to the rabbi and says ""Man, I really wanna fuck these kids."" The Rabbi replies ""Outta what?""",1
 Dhaka cafe standoff: At least 13 hostages rescued ,0
why are bouquets only for flowers? why not a bouquet of hot dogs. or a bouquet of hot dogs with ketchup. or a bouquet of hot dogs with musta,1
Eric Garner’s girlfriend asks for restraining order against his daughter,0
Who leaves money under the pillows of children with LGBT parents ? Surely you will have guessed - the brooth fairy.,1
Big Thief,0
Me: You have to be nice or Santa won't deliver any toys this year. 5: Me: 5: My brother lets me play with his.,1
Clinton vs. Trump: How to fix an already predictable debate,0
Him: Are you gonna kill me? Me: WHAT? Him: Your mood swings. I figured today's the day I die. Me: Him: *whispers* Please don't hurt me.,1
"""Meh-eh-eh. Meh-eh-eh"" - Apathetic goat.",1
Why are spiders so unproductive? Because they hang out on the web all day!,1
SORRY FOR MY POOR VOLUME CONTROL REGULATION BUT THIS IS A GOOD CUDDLE,1
Adnan Syed granted new trial in ‘Serial’ case after spending 16 years in prison,0
Sometimes I think I'm a relatively smart person. Other times I put my shoes on before my pants and realize who I really am.,1
Pablo was a family man. That's why he had two of them.,1
How many bear arms could Bear Grylls bear to bear if Bear Grylls could bear to bear bear arms? bear,1
The lonely struggle of a gay Mormon,0
It's better to have loved a short man than to never have loved a tall.,1
So... There was a kidnapping at my school... But don't worry-- he woke up.,1
WH Spokesman: Flynn Had 2 Calls With Russian Ambassador,0
"Carrie Fisher: tell me your story, I’ll tell you mine",0
I consider anything that doesn't fit in the dishwasher to be for one time use.,1
Uphill battle looms as Trump seeks revamped healthcare plan,0
Why is football the single best sport? Because americans don't play it.,1
"At the end of each day, life should ask us, Do you want to save the changes?'",1
Want to know how to lose 100 pounds? Go to the London casino...,1
‘I want everyone to know what happenedâ€™: Brothers arrested in the homicide of couple found with chilling note,0
Senate Intel Dem: Comey Firing Indicates Trump Admin Is ‘Afraid’ Of Russia Probe,0
"What is your favorite ""There are two kinds of people..."" joke? My favorite is ""There are two kinds of people...those who cheat at 7-up, and god damned liars.""",1
Where are average things manufactured? The Satisfactory,1
Plane headed to NYC makes emergency landing,0
What do you call a confident chicken? Cocky,1
Gawker discussing ‘potential settlement’ with Peter Thiel reps,0
What does Bruce Lee drink when he's thirsty? Wa-TAH!,1
Who cares about throwing stones? How do people in glass houses hide when somebody knocks on the door?,1
"What's Fuzzy, Smokes, and Comes in Cubes? Fidel Castro.",1
"They agreed upon 'almond milk' when the original name  flavoured nut water  was rejected by test audiences, for whatever reason...",1
"Knock, knock. Who's there? Deja. Deja who? Knock, knock.",1
’Overwatch’ Takes Home Game of the Year at 2017 DICE Awards - Breitbart,0
Danish Study Links Fish Oil During Pregnancy With Lower Asthma Risk In Kids,0
There are two ways to trigger a nuclear chain reaction: ... The first involves hitting uranium with accelerated protons. The second is mentioning Hillary and Feminism in one sentence.,1
"Whenever I'm feeling hopeful for future generations, I squelch it by watching my children move their heads instead of their toothbrushes.",1
"After Appeal By Portland Survivor, More Donations For The Girls He Defended",0
Becoming hard to tell difference between credible news organizations like 4chan and troll sites like New York Post.,1
"YouTube Banned Me, but Not the Hate Imams",0
"""Son, I don't think you're cut out to be a mime."" ""Was it something I said?"" Asks the son. ""Yes.""",1
Family’s return to rebuild Aleppo street points to Syria’s future,0
"Wanna hear a joke about my penis? Nah, that would be too long anyway.",1
Swiss police: 3 injured in gunmanâ€™s attack at Zurich mosque,0
I'm more than tenacious. I'm elevenacious.,1
What do you call a nun sleep walking? A roamin' Catholic,1
What do you call? What do you call an anorexic with a east infection? A quarter pounder with cheese.,1
"How many developers does it take to change a lightbulb? None, that's a hardware problem",1
"What bounces and makes kids cry? My donation cheque to ""Children in Need"".",1
My Russian mate does not care about anyone.  His name is Yukanol Fukov.,1
Blank Book Titled ’Reasons to Vote for Democrats’ Tops Amazon Bestseller List,0
What do you get when there is an inconsiderate weather phenomena at an EDM concert in Dubai? Darude Sandstorm.,1
Who is Bob Dylan's favourite soccer player? Harry Kane.,1
Trump Sealed Carrier Deal With Mix of Threat and Incentive - The New York Times,0
I hear you knocking at my door. You thinking I'm going to answer it is your second mistake.,1
"Girls can be so ungrateful sometimes... I made breakfast in bed for her and instead of saying ""Thank you"", she was all shouty like ""How the hell did you get in my house...?""",1
This is what incompetence looks like,0
EgyptAir flight MS804: repairs needed to ’extensively damaged’ black boxes,0
A man died while masturbating The doctors said he died from a stroke.,1
womens rights Lol,1
Homeland security unveils Trump’s controversial immigrant crime office,0
George P. Bush urges Republicans to back Trump,0
Maslow's theory of higher needs does not apply to Chuck Norris. He only has two needs: killing people and finding people to kill.,1
"Police Officer and the Pothead Police Officer: ""How high are you?"" Pothead: ""No officer, it's ""Hi, How are you?""",1
"Haven't taken a dump in 4 days and I feel fine. Then again, I could just be full of shit.",1
What do you call 24 carrots? Edible gold.,1
Administration eases visa rules for travelers visiting terror hotspots,0
"I read to blind kids in my spare time. Their favorite book is ""2dots1dot3dots 4dots3dots 5dots2dots1dot 2dots1dot5dots.""",1
"Gunmen Execute Young Couple, Set Vehicle on Fire near Texas Border",0
Russian plane with dozens aboard crashes into Black Sea,0
Mama Pig has a great new kitchen appliance that lets her prepare meals ahead. It's called a garbage compactor.,1
The albatross of a Trump endorsement,0
Hillary Clinton and Elizabeth Warren Take Aim at Donald Trump - The New York Times,0
Every joke posted on this sub is stolen from Sickipedia. If you are going to steal someones joke at least give credit.,1
What is Hitler's IP address? holocalhost,1
Jihad balloons are my favorite They blow themselves up,1
"Television reporters told to stop recording in Senate hallways, prompting outcry",0
Whyisleatherarmorbestforsneaking? It'sliterallymadeofhide,1
What's the similarity between being in the mob and... eating pussy? One slip of the tongue and you're in deep shit,1
what's the difference between BMW and a Porky Pine? The porky Pine has the prick on the outside.,1
Panicked about the WikiLeaks smart TV disclosure? Here’s what you should know.,0
Trump: Megyn Kelly Should Give Me ’Half Of Her Salary’ For Helping Her Ratings,0
Why did the Spanish train aficionado blow up his trains? He had loco motives.,1
"I keep having to remind myself that an ""oral history"" is not nearly as exciting as it sounds.",1
Google apologizes to ad clients for YouTube content fiasco,0
JonesTown Massacre Do you know why you never hear any jokes about the JonesTown Massacre? .......The punchline is too long!,1
"The very first thing my 3yo daughter said to me this morning was ""I know how to start a fire!"" so nothing you guys say today can scare me.",1
NYPD admits ’we failed’ in police shooting of mentally ill Bronx woman,0
"Women may not hit harder, but they hit lower.",1
"I remember being told that everytime you shave it off, it grows back thicker Can't wait to see my new cock.",1
Mexican president contradicts Trump’s account of border wall discussion,0
Two wrongs don't make a right. And two half-wits don't make a wit.,1
How did the hipster burn his tongue? He drank the coffee before it was cool.,1
A Christian and an atheist walk into a bar. They proceed to have a few drinks and enjoy each other's company because they're not pretentious dicks.,1
Why did the pig break up with her boyfriend? He was a boar.,1
Common sense is a flower that doesn't grow in everyone's garden.,1
Big Wind Blown Away in Vermont,0
 University Of Minnesota Football Players End Boycott Over Sex Assault Suspensions,0
House opens inquiry into deaths of drug-dependent newborns,0
A Guide To Britain’s ’Brexit’ Vote,0
Game of Thrones is why I have trust issues.,1
Beer makes you stupid.... Budweiser too.,1
A faithful coach wants his job back,0
"Son, that bear is more afraid of you than you are of ... oh wow, that bear is being really brave right now.",1
"Trump: ""Knock knock."" Donald Trump: ""Knock knock."" - Who's there? ""No way-Jose"" - No way-Jose who? ""No way-Jose getting over that fucking WALL""",1
"What does a Men's Rights activist call a broken hand? Celibacy. (Edit: LOL! Seems I've ""triggered"" some folks with broken hands and fedora collections.)",1
What do you call a prostitute that does both men and women? An omniwhore,1
What is an emo's favorite note? G ...get it? EDIT:im not saying the reference,1
"Tom Swifty ""My mom is my dad!"" Said Tom transparently.",1
My parties got a hundred times better when I realized if I didn't invite anybody I could eat all the snacks.,1
Why couldn't Helen Keller drive? She was a woman,1
Just accidentally opened iTunes so now I can't use my computer for the next hour or so,1
Exclusive - Aboard AA990: A curtain comes down on U.S. swimmers’ gold medal glory,0
I have a theory that consuming little bits of peanut butter encased in colored candy shells provokes silly rhymes. I call it my Reeces Pieces Thesis. . . . . I'll see myself out.,1
What do you call a wife that knows where her husband is at all time? A widow,1
"Dear God, I asked about atheism today.",1
Supreme Court backs beards in prison,0
Two friends: - I heard that you have founded a musical band. - Yes it is a quartet. - How many are you? - We are three. - Three? - Me and my brother. - You have a brother? - No why do you ask?,1
World’s oldest woman says eggs are secret to long life,0
Winnie-the-Pooh is in tears He got Triggered.,1
"I watched a gang bang video involving several bus drivers and one woman. She looked bored for half an hour, then suddenly they all came at the same time.",1
Checkmate for Senate Repubs?,0
Slain dog’s owner wants pit bull put down — now,0
Can disparaging trademarks be denied? The Supreme Court is skeptical.,0
CLERK: $3.74 ME: *reaches in pocket & pulls out whole ham* sorry I have cash *reaches back in & pulls out 2nd ham* well this is embarrassing,1
I want to work for YouTube. It sounds so easy! All you have to do is remove a few lines of code everyday!,1
West Virginia police officer sues after being fired for not shooting black man,0
"I went for a job interview today... The interviewer said to me, What would you say your greatest weakness is? I said, I think Id have to say my listening skills are my greatest strength.",1
What is the only planet you can visit on Earth? Ur anus,1
Instagram couldn't complete your request at this time because nobody cares about your Sunday brunch.,1
How much energy does it take to create a rap star? 1.21 Jigga whats.,1
T NOW! what do we want? MORE TIME TRAVEL JOKES!! when do we want them? RIGH,1
isnt it cool how we all accepted that we all know the names of streaming porn sites and didnt ask each other how we knew of them,1
Pokemon Go and Chuck Close: The Week in Pop-Culture Writing ,0
"BOSS: Don't just stand there. ME: Bust a move? BOSS: What? ME: Nothing, I'll go make some copies.",1
"Last night, my sexy Japanese friend asked me out for dinner. ""Hey, you wanna go for sushi? It's on me."" It's funny 'cause I paid the bill.",1
Toddler is brain dead after caregiver straps him in car seat wrong,0
"What is the most popular birthday based on Internet records? January 1st, 1993",1
What do you say to a woman with two black eyes? Nothing. You already had to tell her twice.,1
The Decline of the Bundy Rebellion,0
"Haters gonna hate, alligators gonna alligate",1
The deadliest Knock Knock joke... [PERSON 1] Knock knock [PERSON 2] Who's there? [PERSON 1] You know... [PERSON 2] You know who [PERSON 2] AVADA KEDAVRA!!!,1
"I told my wife the truth. I told her I was seeing a psychiatrist. Then she told me the truth: that she was seeing a psychiatrist, two plumbers, and a bartender.",1
Steph Curry is still giving Under Armour a major boost,0
Looks like I picked the wrong week to quit making 'Airplane' refrences,1
"If you get colon cancer, your prognosis depends partly on where it started",0
"A blonde strolls into her new office job at 10:30 The manager comes up to her and says, ""you should have been here at nine o'clock,"" to which the blonde responds ""why what happened?""",1
Fred's new girlfriend uses such greasy lipstick that he has to sprinkle his face with sand to get a better grip.,1
General Mills Recalls Some Flour After Consumers Fall Ill - The New York Times,0
"Riddle me this Which does not belong: * Nipple clamps * Soy * Vibrator Answer: The nipple clamps, the other two are meat substitutes.",1
"English is weird... but it can be understood through tough thorough thought, though. Yeah you red it rite.",1
"Newlywed, Iraq veteran among the 5 Dallas police officers killed",0
"’Revenant’ Reveals A Breathtaking, Punishing Saga Of Survival And Revenge",0
Why don't Bill Cosby's Lights Work? He required that their circuits have no resistance.,1
Not saying you're shady but there is a family of squirrels gathered around your ankles.,1
De Blasio still doesn’t get how New Yorkers look at crime,0
Yo mama's so old... Her age has to be expressed in scientific notation!,1
Russian oligarch lists $88M Central Park penthouse,0
I am not a ride or die chick. I have questions. Where we going? Will there be food? Why do I have to die? Why didn't you like my last pic?..,1
"‘S.N.L.’ Goes After Trump Again, With Melissa McCarthy as Sean Spicer - The New York Times",0
"When you mount a gun rack above your desk, it's surprising how many PowerPoint presentations you simply don't have to see.",1
Not wearing condoms because the world needs more people like you.,1
this guy was telling my friend from puerto rico trump was gonna deport him and send him back to mexico I never laughed my ass off so hard.,1
I was getting drunk with this cute girl and booze was going everywhere. Then suddenly I slipped in cider.,1
Good News For Procrastinators: 3 Extra Days To File Taxes,0
"What's the difference between a cat and a comma? A cat has claws at the end of it's paws, a comma has a pause and the end of it's clause.",1
"Pope Awards Medals to Celebrities George Clooney, Richard Gere, Salma Hayek",0
Why did the baby squirrel wear a diaper? To hide his nuts!!,1
"Two crows walk into a bar. Before they can order their first drink, they get arrested for attempted murder.",1
I ran out of tortilla chips so I'm freebasing salsa.,1
How fuckin' good do babies smell!? I wanna jam one up each nostril and rob a bank!,1
WHISKERS: There's nothing there. Go ahead. BLIND PERSON: *Steps off cliff* WHISKERS: Technically ^-- why we don't have seeing-eye cats,1
Donald Trump The joke's in the title.,1
Highlanders: The architects redefining Scotland’s far north,0
"Kevin fills a beaker of water and places it on the machine... ""One liter of water."" it read. Kevin gasped and sat back in his chair ""This speaks volumes...""",1
"The Atlantic  Politics & Policy Daily: Good Night, and Good Luck",0
Which two letters of the alphabet are  nothing? MT (empty) .,1
Contractor charged in NSA document leak case,0
Peruvian president: Here’s the first thing I’ll tell Trump when I meet him,0
*stands next to ATM and cheers every time someone wins money*,1
Popped a tire on a pot hole today Badum tss,1
Looting has hit London's Covent Garden Specifically the new Apple Store. Police are looking for iWitnesses.,1
"Carswell and Hannan Freeze Out Farage, Say They WON’T Stop Immigration",0
ICE Officers Round Up 113 Criminal Aliens in New Jersey Sweep,0
Can't believe i actually met a guy named Dick Putinson,1
There was a water fight at our local park today... ...and I won!!! Nobody is a match for me and my kettle!,1
"Every time you have McDonald's as a kid, it's a victory. Every time you have it as an adult, it's a defeat.",1
my girlfriends dad asked me what I do but apparently your daughter wasn't the answer,1
Maybe this lady is trying to perpendicular park.,1
"To be honest, Adolf Hitler was a hero... Afterall, he was the one who killed Adolf Hitler.",1
Elderly woman jumps to her death from luxury building,0
What do you call a shitty city? Turd Furgeson,1
How much business does an Amish prostitute get? Ten Mennonite,1
"I asked 100 women which shampoo they preferred.... Almost all of them replied, ""How the hell did you get in here?""",1
Young Billy stuck the knife into the outlet... He said it was a shocking surprise.,1
Andy Murray slams ‘simply untrue’ rumours of rift with Amélie Mauresmo,0
"Flattening the ""duck curve"" to get more renewable energy on the grid",0
What did Batman say to Robin before they got in the car? Get in the car,1
What do you call an army of toddlers? Infant-ry. *insert cringe here*,1
Governor signs bill stemming from Brock Turner case,0
What do you get when you cut an Avocado into 6.02 x 10^23 pieces? a guacaMOLE,1
"A banker tells his client that a 1,000,000 investment will turn into a ton of money! So the the client asks ""How much is a ton of money"" The banker responds ""Two Thousand Pounds""",1
"How A ’Sixth Sense’ Helps Simone Biles Fly, And The Rest Of Us Walk",0
Regulations make it too hard to sell home-cooked food,0
Premier League and EFL Cup: eight talking points from the weekend’s action,0
"Yes, there is a free speech crisis. But its victims are not white men",0
Corruption scandals weigh on Ecuador’s leftists ahead of vote,0
"Truman Capote’s ashes sold for $43,750",0
Is your refrigerator running? Because refrigerator obesity is on the rise.,1
"William McPherson, Pulitzer-winning book critic who chronicled his decline into poverty, dies at 84",0
We named our beautiful daughter after my mother. Passive Aggressive Psycho turns 22 this year!,1
How A Broken-Hearted Young Girl Found Healing In Her Grandmother’s Vadais,0
Will Donald Trump Debate Hillary Clinton?,0
US women make it 1-2-3 at Rio in 100m hurdles,0
"I said ""I'm not going to repeat myself""",1
One man's trash is another man's girlfriend.,1
Trump Compares His Campaign To Brexit. What Do Britons Think?,0
I found a bunch of money I didn't know I had while cleaning for company... ...it was like Christmas.,1
"I'm suffering from a more rare kind of stomach ache. It's called Indiegestion, I doubt you've heard of it before.",1
What do you call a cow with a twitch? Beef jerky.,1
What is the difference between the US and yogurt? If you leave yogurt for 200 years it'll grow a culture.,1
Why did my girlfriend cross the road? To get back to the first shop we went to 4 fucking hours ago!,1
"*picks up bug, puts it outside* There ya go. *later, bug smashes thru door carrying gun* You should have killed me when you had the chance",1
"Spoiler alert: most people want to remain in the dark, finds study",0
Why was the lion a terrible cannibal? He couldn't swallow his pride.,1
*tries to flirt* *twirls hair in fingers* *fingers get caught in giant knot* *learns to live using only one arm*,1
Since Canada isn't making the penny anymore-did the price of a thought just go up to a nickel?,1
Why didn't the black kid play Pokemon? He was afraid they were trying to catch Jamal.,1
Republican lawmakers reject calls for inquiry into Michael Flynn’s Russia links,0
I gave my friend a gluestick instead of chapstick last weekend and she's still not talking to me.,1
Abercrombie & Fitch’s attempts to rebrand have totally backfired,0
Interviewer: Is it true you are the first duck to be made a duke? Duck: Please address me as 'M'llard',1
Interviewer: your resume says you were a waiter Me: yes that's right Interviewer: where at Me: out in the lobby right before this interview,1
*puts a picture of Roger Rabbit in a picture frame* I did it. I framed Roger Rabbit.,1
I love being married. It's so great to find that one special person you want to annoy for the rest of your life. ,1
I'm not racist because it's a crime. And crime is for black people.,1
"Why didn't anyone believe the transsexual's confession? It was a case of 'he said, she said'",1
Justice and Accountability in Courtroom and Laboratory,0
If I had a nickel for every racist thing I've said... I would be able to buy a Nigger,1
Canada is nearing ’peak crazy in the housing market’,0
What do women and condoms have in common? They spend more time in your wallet than on your dick.,1
"Bill Maher: Liberals Protested Apartheid in One Country, Ignore Sharia in 40 Countries",0
LeBron James soap opera could get worse with Carmelo visit,0
Can Rubes Recover Footing (?) Live Blogging,0
All of the US’s energy consumption in one giant graphic,0
What do you call a bouncer at a gay club? A flamethrower,1
I've never enjoyed my surprise birthday parties because all I can think about is how good my friends are at lying to my face.,1
Syria Fires Missiles at Israeli Warplanes - The New York Times,0
The sunrise is beautiful and all but i wouldn't get out of bed for it,1
What happens if you steal in Afghanistan? You get Talibanned,1
Why did two owls get arrested for the same crime? They were in ca*hoots*.,1
It's hard to imagine someone getting any pleasure from beastiality... but that doesn't stop me from trying.,1
What do you call it when two Vietnamese people meet? A Nguyen-Nguyen situation,1
"I'm at the wailing wall, standing there like a moron, with my harpoon. -Emo Philips",1
New GOP resistance in push to create Senate committee on Russia,0
