sentence,is_humor
Good Samaritan Helps Boy Survive ‘Internal Decapitation’ in Idaho Car Crash - The New York Times,0
Question everything. Or should you?,1
"Isn't it nice that soon Justin Bieber will go through puberty, Twilight will end, & Mr.Potter's gone? Everything's going to be normal again",1
Michael Flynn said to be offered job of Trump national security adviser,0
School Parade in Taiwan Featuring Swastikas and Nazis Unleashes Uproar - The New York Times,0
New Tyrannosaurus rex skeleton latest in a flurry of finds,0
Deli-plomacy: New York’s famous Katz’s Deli bemoans loss of Carnegie rival,0
I am so bored in my current profession. I am thinking of becoming a bartender... ...to shake things up a bit.,1
War of words with pope no issue for Trump backers: Reuters/Ipsos poll,0
The people behind the popular ’Mass Effect’ games have a brand new title: ’Anthem’,0
Tech CEOs meet with Trump on government overhaul,0
Soaring Disney Studios hopes for $7bn fairytale ending to its year,0
"After A Rough Run-Up, Rio Aims For An ’Awesome’ Opening Ceremony",0
So how do you stop eating the endless breadsticks at Olive Garden does the restaurant close or are you supposed to bring a spotter with you?,1
The Five Stages of Christmas Shopping Grief: - denial - anger - strong language - moderate violence - a lifetime ban from Toys R Us,1
What's the difference between a baby and a feminist? I don't want to punch the baby in the fucking face.,1
Why did the Broncos wear white jerseys in Super Bowl 50? Because it's hard to catch a white bronco in California.,1
What do you call a bread that catches a cold? Flu-catcher bread,1
Uber CEO Travis Kalanick says he’ll talk to Trump about the immigration ’ban’ on Friday,0
"Time Saving, Common Sense Rules Proposed by Golf’s Governing Bodies - Breitbart",0
A racist joke What is the difference between a pizza and a black guy? A pizza can feed a family of four.,1
"I always carry a mushroom with me, just in case my enemy shows up & I need something to make me bigger.",1
US paid Iran $1.3B two days after $400M cash transfer,0
What did the mother bullet say to the father bullet? We're having a BB.,1
UAW chief says Clinton told him she would renegotiate NAFTA,0
"I once met a girl with 12 nipples Sounds funny, dozen tit",1
What’s Next For Transgender Rights Lawsuits With School Guidance Rescinded,0
Florida Family Discovers Blood Seeping From Elevator: ’Real Life Scene of ’The Shining’’ - Breitbart,0
"I hate recursion, irony, and the Oxford Comma.",1
"There are 10 kinds of people in the world.... ...those who understand Binary, and those who don't.",1
The Future of Not Working - The New York Times,0
The Vexing Economics of Obamacare,0
"A fun thing to do would be to eat rat poison during a dinner party & then, when you die, they'll blame the host's cooking. Lol.",1
Where do pregnant chickens keep their ultrascan images? In a photo albumen.  \_()_/ ,1
What was Cher doing before she was born? She was a preacher.,1
50 cent files for bankruptcy He only had 50 cent,1
"Recently joined the mile high club sandwich. That's when you have sex on a plane, and it's with a sandwich",1
The Supreme Court’s chance to stop the criminalization of politics,0
"CNN 10 - January 30, 2017",0
My voicemail message is a 20 second recording of me sighing.,1
CNN reporting that CNN will be reporting something on CNN. Tune in to CNN for all of the up-to-the-minute stuff CNN is reporting.,1
What's the difference between a slice of toast and an Iraqi..? You can make soldiers out of a slice of toast,1
‘Madoff of landlords’ accused of using ex-cop to harass tenants,0
Evacuations canceled for Southern California brush fire,0
Did you hear about the cannibal who showed up late to the luncheon? They gave him the cold shoulder.,1
What does a tickle me Elmo get before it leaves the factory? Two test tickles,1
The Week The Judicial Branch Didn’t Exist On The White House Website,0
Hulk is ready to rumble in $100M Gawker lawsuit,0
"Apparently, Engineers talk how Doctors write",1
Obama is trying to fix the ’war on drugs’ with clemency — but it won’t make a dent in mass incarceration,0
"Do you want to hear a construction joke? Sorry, I am still working on it.",1
Breitbart/Gravis Poll: Majority Thinks CNN Not Objective,0
What do you get if you mix Coco Pops and milk? Chocolate milk! What do you get if you mix Coco Pops and chocolate milk? Diabetes,1
When you said coke I assumed you meant cocaine. No thank you. Soda is bad for you.,1
Bring Back That ‘Do-Nothing Republican Congress’,0
What did the leper say to the prostitute? keep the tip bitch.,1
J.R. Smith asks for prayers as daughter is born 5 months early,0
What do you call a group of physicians with erectile dysfunction? Doctors Without Boners,1
Kristol Lays Out Strategy to Give White House to Hillary: Trump ‘Shouldn’t Win’ - Breitbart,0
"Krauthammer: Trump Biggest Winner of 2015, Netanyahu the Biggest Loser - Breitbart",0
"When in trouble I think What Would Justin Bieber Do? scream like a little girl, grab nonexistent testicles & run away awkwardly.",1
Archaeologist defies sceptics in pursuit of lost city of Trellech,0
Blind Man A blind man walks into a bar...and a table...and a chair.,1
WATCH: Pakistani Muslim Girl ’Comes Out’ As Transgender To Obama Live During Q&ampA In London,0
Work like you don't need the money: Just stop and go home. Who cares? You don't need that money,1
Where do you find a quadriplegic? There where you left him.,1
German Olympic Coach Dies Following Car Accident in Rio - Breitbart,0
My printer has a drug problem And it just can't stop!,1
Why Summer Jobs Don’t Pay Off Anymore,0
DNA database brings scientists closer to pinpointing genes for disease,0
"What's the difference between an Isis camp and an orphanage? I don't know, I just fly the drone",1
"I drank so much wine last night when i walked across the dance floor to get another glass, i won the dance competition.",1
"*ref blows whistle* Whistle: oh, oh god, wow. Oh geeeze",1
’Alien’ Signal Source Reportedly Located (It Wasn’t The Vulcans),0
i blame everything on the illuminati. stale bread? illuminati.,1
"On sensitive U.S. stopover, Taiwan leader connects to Twitter",0
Wet Astronaut The astronaut thought he was taking a pee but it turned out to be a piss-up.,1
What did the Sewage Worker say to his apprentice? Urine for a surprise. ^^^^^sorry,1
My favourite kind of pain; is in my stomach when people make me laugh too hard.,1
 This News Anchor Learned Of Her Husband’s Death While Reporting It On Live TV,0
How does Dallas Cowboys fans change a lightbulb? They don't... they just talk about how good the old one was.,1
Have You Ever Taken a Bus? WELL THEY WANT IT BACK!!!!!!,1
Kinda corny but it did actually crack me up... Q. What do you get if you insert human DNA into a chimpanzee? A. Banned from the Zoo.,1
South Carolina passes bill banning abortion after 19 weeks,0
"I can't afford an electric toothbrush, so I just roll a baby hedgehog in some toothpaste and hold in it my mouth for 15 minutes.",1
"Guys, want to find out all of your flaws in under a minute? Just ask your girlfriend if she's gained weight.",1
Follow the data: does a legal document link Brexit campaigns to US billionaire?,0
I turned into a cat earlier Don't ask meow,1
What do you call a snobby criminal walking down the stairs? A condescending con desending..,1
"On the Clinton-Kaine bus, a hope for the electricity of Clinton-Gore",0
How many narcissists does it take to change a lightbulb? One to hold it and the rest of the world to spin around them.,1
"It's ""hairs"" not the collective ""hair"" now. I have so few I know each individually by name.",1
Veterans Group to Protest Flag Removal at Hampshire College - Breitbart,0
I'm a victim of child abuse Some kid in the park called me ugly,1
Where do you send a Jew with ADHD? A concentration camp!,1
White Sox Turn Third Triple Play of Season Against Braves - Breitbart,0
"[God creating the ocean] GOD: Just put water friggin everywhere. ANGEL: Nice, that way if they're thirsty, they GOD: Make it undrinkable.",1
"As Syrian Government Forces Advance, The War Could Be At A Turning Point",0
Brother: Did you put the cat out ? Sister: Why is it on fire ?,1
"[10 mins into couples therapy] Therapist: I cannot help you two. Me: Let's go, Betsy! See! She doesn't listen! T: GET YOUR DOG OFF MY COUCH!",1
"Whether you’re leave or remain, Theresa May just betrayed you on Brexit",0
My cock was actually in the Guinness Book of World Records once... But it really pissed off the librarian and she kicked me out!,1
Why can't a Pirate make it through their ABC's? They always get lost at C.,1
"God said, ""Peter, come forth..."" But he came fifth and got a toaster instead.",1
This woman 3-D prints her jewelry,0
I have friends who do charity work for U2. They're pro Bono.,1
"Friday Reads: 5 Rings, 5 Books For Rio",0
"OPEC, key producers to discuss six-month oil deal",0
It’s the Stanley Cup final – so here’s our 10-step guide to being a hockey fan,0
Trump wings it without chief of protocol,0
"Another Old Blonde Joke A brunette yells to a blonde across a river, ""Hey! How do I get to the other side of the river?"" The blonde yells back ""You are on the other side!""",1
How do you have nasal sex? Fuck nose.,1
How many geese does it take to form a gaggle... 5 or more,1
Why does Waldo wear stripes? Because he didn't want to be spotted!,1
Rick Perry’s wife explains 2012 flameout,0
Donald Trump Adjusts His Complaints About Debate Microphone - The New York Times,0
What's the difference between me and Santa? Santa only comes down your chimney.,1
Pity poor Britannia. God save America.,0
I had a really big shit the other day. It was a real pain in the ass.,1
Faux-pulist: Elizabeth Warren Condemns Sessions for Suggesting Wealthy Corporations Should Hire Americans,0
"Knock knock! ""Who's there?"" -To ""To who?"" -To *whom*",1
’For Honor’ Players Discover All Unlocks Would Cost over $700 – or 2.5 Years of Playtime - Breitbart,0
kids born in 2000 never have to worry about forgetting how old they are,1
"A Poem Roses are red, Violets are blue, Stop memes about Harambe -Cincinnati Zoo",1
"I can't decide what's scarier, someone scrolling through the pictures on my iPhone or someone scrolling through my Google search history.",1
"Gorsuch, London, Republican Party: Your Thursday Evening Briefing - The New York Times",0
Michael Moore: ’Nobody Should Treat’ Donald Trump Like a ’Joke’ Now - Breitbart,0
Jason Bourne returns with $60m in opening weekend as Bad Moms delivers,0
"My brother committed suicide and didn't leave a note. How inconsiderate of him. I mean, would it have killed him to leave a note?",1
The worst mix of diseases? Alzheimer and diarrhea. You run but you don't remember where.,1
"CNN Student News - August 17, 2016",0
What's it called when you're killing time at work hiding in the bathroom? Stalling.,1
 17 Facts The World Learned In April,0
Mountains... They peaked years ago,1
Seth Meyers Questions Kellyanne Conway (and the Politics of Late-Night),0
These women asked their doctors for better birth control. The responses were infuriating.,0
"There are two kinds of people: Those who know how to do math in binary, and those who don't!",1
Trump meets the ultimate adversary in Comey,0
Met a girl at a party and asked if she wanted to go back to my place and hang out. She said she wasn't a whore I said I wasn't offering to pay,1
Roses are red... Roses are red. Violets are blue. I have alzheimers ...cheese on toast.,1
Utah dating homework tells girls: be ’feminine’ and ’don’t waste his money’,0
The 270 Project: Try To Predict Who Will Win The Election,0
"Spared by Gunman in Charleston, Churchgoer Describes Night of Terror - The New York Times",0
New York Times Hits Donald Trump Over Guest Workers at Mar-a-Lago - Breitbart,0
James Dolan tries to help rescue Islanders from Barclays Center,0
’Boy-band governor’ surges in wide-open South Korea presidential race,0
"Two guys walking down the street... ...notice a dog licking his balls. The first guy say ""Man, I wish I could do that."" Second guy says ""You should probably just pet him first.""",1
Q. Is it possible to kill a mother-in-law with  newspaper? A. Yes if you wrap an iron in it.,1
"Just had a 9 minute argument with The Boy over why he needs to change his underwear this morning. Don't forget your birth control, friends.",1
"If I was a waitress, I would plant fake engagement rings in every girls champagne glass, just to watch the boyfriends panic.",1
"I watched her squeeze into the booth, finish 3 Egg McMuffins, & stand-up. ""My knees are killing me, it must be the cold weather,"" she said.",1
What's the difference between peanut butter and jam. You can't peanut butter your dick into someone's ass.,1
Meet Twitter’s new product chief: Jack Dorsey,0
My girlfriend's plastic fork broke while she was eating earlier.... ....Just a tine-y bit. (i was so proud of myself but no one else laughed as much as I did ),1
What do you call a woman who rents out hot dogs? Lisa Frank,1
What can you say about Ham Burger and Chief Justice Warren Burger? Ham Burger is 'well done' and Chief Justice Warren Burger has 'done well'!,1
Why Iraqi police are shooting at protesters in Baghdad’s Green Zone,0
I saw two priests eating dinner the other day... ... didn't know if I should send them a bottle of wine or an altar boy.,1
"How the world went from 170 million people to 7.3 billion, in one map",0
"My cat just started kneading my back in bed and I said ""not now"" so wish us luck we're officially married.",1
How do you the difference between a blond man and a blond woman? The blond woman will have a higher sperm count.,1
"Alcohol Influences If alcohol influences short-term memory, what does alcohol do?",1
Me: I'm happy right now. Life: Lol one sec,1
"My motto is ""Grab Life by the Balls."" As you might imagine, being dyslexic, I spend a lot of time apologizing to guys named ""Leif.""",1
Why did the scarecrow get an award? He was out standing in his field,1
Which is the most dangerous page of the newspaper? C4.,1
I dont care or think about the people in my past... there is some reason why they didn't make it to my future!,1
What's a Muslims favourite animal? Its Lamb,1
I wish people would stop making gay jokes Cum on guys!,1
Sister won't let me eat her out I'm bringing this bullshit up to Father Tim at Sunday Mass.,1
Why is Santa always jolly? Because he knows where all the naughty girls live.,1
Ramen again? This guy's a mess. -mice in my kitchen,1
"Great pickup line... You:Hey, do you have a Memory foam mattress? Her: Yes. You: Wanna Traumatize it?",1
What's the opposite of condescending? [gif](http://25.media.tumblr.com/6b1b800af79638830eef30deb8163bbf/tumblr_ms1l531JGu1s29n2zo1_250.gif),1
President Trump’s new travel ban is much narrower — and possibly courtproofed,0
New Year’s Day Quake In Oklahoma City Amid Increasing Seismic Activity,0
"A Quebecer staying in a hotel in Edmonton phoned room service for some pepper. ""Black pepper, or white pepper?"" asked the concierge. ""Toilette pepper!"" yelled the Quebecer.",1
Trump Time Capsule #114: Trump Foundation and Taxes,0
I like my women like I like my coffee. Irish.,1
"Fast-growing, diverse part of Florida earns special attention from Clinton, Trump",0
"You can put the word ""blood"" in front of ""oranges"" and people will still eat them. Don't even try it, bananas.",1
You’ll probably have way less sex in your life than you think you will,0
Dentist: Did you deliberately loosen this tooth? Me: Why would I do that? D: ok...[extracts tooth & hands me a lolly] Me: *winks at camera*,1
There are only two types of people in this world: Those who can extrapolate from incomplete data.,1
Lawmakers react to John Glenn’s death,0
A man knocked on my door the other day with a beard. No wonder I didn't hear him.,1
"Dad I have to poo! ""Dad I have to poo!"" No answer. ""Dad I have to poo!"" Still no answer. ""Dad I really have to poo!"" ""OK son, I'm pulling out.""",1
I just spent several seconds trying unsuccessfully to delete a comma. Turns out somebody sneezed it onto the computer screen.,1
Watch: Joey Chestnut Sets Hot Dog Eating Record by Eating 70 in 10 Minutes - Breitbart,0
The Trashing of a Generation,0
"*bark* ""What's that Lassie?"" *bark bark* ""Timmy's stuck in a loveless marriage with an overly critical wife?"" *bark* ""Ooh, dinnertime.""",1
Mother Kills Her Children And Herself; Chinese Bloggers Ask Why,0
Zoo visitor: What's the new baby hippo's name? Hippopotamus keeper: I don't know he won't tell me.,1
Broke up with my girlfriend today On the other hand I met this chick.,1
"My wife tried imitating the weird groaning sound her car is making, and all three auto mechanics asked her out.",1
The Gravity is Strong #3,0
Can Quantum Physics Explain Consciousness?,0
The American Revolution was a huge victory for equality. Liberals should celebrate it.,0
Booz Allen reported its billing practices are under investigation — and its shares drop sharply after hours,0
NFL trims list of suspects in hunt for Tom Brady’s stolen jersey,0
"I think im gonna be a comedian Coz my life is a joke :"")",1
There are three unwritten laws of life... 1. 2. 3.,1
"""Thanks for the clarification."" ~ Melted butter",1
Israel’s Peres in medically induced coma after major stroke,0
Healthcare hearing: Democrats try to stall bill as Ted Cruz voices pessimism,0
A fly gets hit by a truck. what is the last thing to go through it's head? It's arse,1
"Fun tip - instead of going on vacation with a baby, stand outside until you're sunburned, then light $1,000 on fire.",1
did you hear about the kidnapping at the high school? It's OK. He woke up.,1
Uber passenger takes sleeping driver on high-speed chase: cops,0
I was sitting in traffic today and I got run over.,1
"Have you ever heard about Mothers Against Drunk Driving's lesser known sister organization ""Fathers Against Drunk Driving""? Probably not, it didn't last very long, it was only a fad.",1
"A porn star comes running up to a laundromat just as it's closing, offering to trade sex so she can wash her clothes. [nsfw] She just wanted to get one more load in.",1
"Republicans are so hopeless, Trump may have to work with Democrats",0
"""A black man follows me when it's sunny outside. When it's cloudy, he goes home."" ""Brick, that's your shadow.""",1
"Trinh Thi Ngo, Broadcaster Called ‘Hanoi Hannah’ in Vietnam War, Dies - The New York Times",0
A tax collector dies and goes to heaven,1
"Here are 5 things Faraday Future wants to do with a $1 billion cash infusion, and what needs to happen first",0
Queens was basically forgotten during Winter Storm Jonas,0
"I like telling car salesmen ""Listen, we both know I'm not here to buy a car"" and trying to figure out what it is they think I'm there to do",1
I'm adopted and I'm glad my parents were at least honest enough to tell me. But why everyday?,1
 The U.S. Military Is Betting On “Smart” Drones — Lots And Lots Of Them,0
Whats the difference between a Mexican and a power tool? Power tools are found inside the Home Depot.,1
The proper skirt length is at least 2 inches below your cellulite.,1
Brake fluid I know a guy who is addicted to brake fluid. He says he can stop anytime.,1
"When people show me pictures of their kids, I show them pictures of my exes If I have to look at their mistakes, they have to look at mine.",1
The College Try,0
Where does a homosexual Southerner live? In dick-sea land,1
Democrats’ empty anti-Trump stunts have made the Senate a circus,0
What If the Terrorists Are Already Here?,0
Trump touted his blocked travel ban after police responded to ’terrorist incidents’ in London,0
What do you say when you walk in on an East Indian woman dressing? Sari!,1
"You're just like my little toe, because I'm going to bang you on every piece of furniture in my home.",1
"In City Built by Immigrants, Immigration Is the Defining Political Issue - The New York Times",0
"I was told I was addicted to cocaine, but I can assure you I am definitely not. I just love the way it smells.",1
"SOBER is actually an acronym that stands for: Son Of a Bitch, Everything's Real",1
Why didn't Natalie Wood take a shower on the boat? She wanted to wash up on shore,1
’Snowpacalypse2017’ And Flooding Clobber Western States But Ease Drought,0
"What's the difference between a line of naked women and a magician? Well, the magician has a cunning array of stunts...",1
Will a parliamentary hearing make Singapore PM’s problems go away?,0
My dealer said he'll be here in 20 minutes with the best popcorn ever. We're gonna watch a movie!,1
Donald Trump just dragged Jeb Bush’s ‘mommy’ into their fight,0
Unproved Claims Re-Emerge Around DNC Staffer’s Death: Here’s What You Should Know,0
A guy just offered me 8 legs of Venison for 40. Does that sound too dear?,1
 This Is What It’s Like To Work Out At An LGBT Gym,0
Soccer Star Accidentally Thanks Both His Wife and His Girlfriend in TV Interview - Breitbart,0
What do you call a group of senior Japanese comedians? Comic Sans,1
Looks like it's time to start pretending Andy Murray isn't Scottish again...,1
"How many pornstars does it take to screw in a lightbulb? Two, and a really big lightbulb.",1
"Oh, you sent me an event invite on Facebook? We've never met and you live 2,400 miles away, of course I'll go!!",1
I only wash my hands when other dudes are in the bathroom.,1
Hillary Clinton comforts boy on ’Humans of New York’,0
When I told you the dishwasher is loaded what I meant was... My wife is drunk.,1
Professor opened with this in first year engineering lecture: What do engineers use for birth control? Their personalities,1
Why does KFC only sell christian chicken? Because the muslim ones are on the no-fry list.,1
Why'd the hipster burn his mouth on his coffee? Because he drank it before it was cool.,1
Detained Illegal Aliens End 3-Day Hunger Strike,0
"What did the white guy say when he found out his sister got knocked up by her black boyfriend? ""Well I'll be a monkey's uncle!""",1
"A Hydrogen atom suddenly exclaimed: ""I think I just lost my electron!"" ""Are you sure?"" Asked its friend, ""Yes"" replied the first, ""I'm positive.""",1
Donald Trump promised to go after leakers. Now he’s doing just that,0
"Today seems like the perfect day to make important life altering decisions! - Me, when I've gone two days without sleep",1
Hackers Demand Ransom Payment from Disney over Stolen Copy of ’Pirates of the Caribbean 5’,0
Is the Republican health plan designed to fail?,0
"How Russian bombing is changing Syria’s war, in 3 maps",0
A Black Couple Are Having Sex Black guy: Who's yo daddy? Black girl: I dunno lol Black guy: Same lol,1
"I always wondered what the job application is like at Hooters.. do they just give you a bra and say, ""here fill this out""..?",1
"""Serving size: half sandwich."" Really, ice-cream sandwich manufacturers? I know what you're doing. And I don't like it.",1
Obama Administration Surge Agenda Threatening U.S. With 100 Syrian Refugees Per Day,0
"[me as a ninja] [a smoke ball is thrown in a park] [when the smoke clears, all of the dogs in the park have stealthily been petted]",1
What makes cheerleaders nervous? Being late,1
I heard you were in to fitness... well ima be fitness dick in your mouth in a second,1
The hidden heart of unaccountable big government,0
 The Alt-Right’s Meltdown Is Just Like Any Other Message Board Drama,0
Breaking: IDF Soldier Wounded in Suspected Sniper Attack Near Hebron,0
"Whenever someone says ""you know who you are,"" I always wonder if it's me and I don't realize it.",1
What did the pirate say on his 80th birthday? Aye matey.,1
" Hello Americans, Here’s Why The UK Is Having YET ANOTHER Election!",0
Where was the first chicken fried? In Greece.,1
Russian bombs take toll in Syria as Islamic State under pressure ,0
What’s The Prognosis For $3 Billion Zuckerberg Health Plan?,0
If a woman puts me in the friend zone I immediately borrow money from her and never pay it back because that's what friends do.,1
‘Silicon Valley’ star still feels lost in the real tech world,0
"I just wanna give a shout out to the ancients, for inventing the calendar. It has made my day",1
Washington Redskins Spike Football After Asian ’Slants’ Band’s Trademark Victory at Supreme Court - Breitbart,0
"Whenever my anorexic girlfriend says she needs a pee, I never know if she needs the toilet or she's just hungry.",1
What did Einstein text to his friend who he'd see tomorrow? E=MC U L8R,1
Beyond Scandalous Selfies: Documenting Anthony Weiner’s Downfall,0
"So, Bill Gates and Steve Jobs walk into a bar... and I got sued for millions because I used both of their names in the same sentence.",1
So a politician dies... Ha!,1
"Progress, but no deal yet on Iran nuclear talks",0
Oil up 7 percent as Iran welcomes output freeze without word on cuts,0
Which programming language got a sex change? Fortranny,1
Why are there no black CIA agents? Because you'd never be able to convince him to help the massive drug smuggling conspiracy that's shipping cocaine into his family's neighborhood.,1
McDonaldâ€™s quietly ended controversial program that was making parents and teachers uncomfortable,0
"I hope one day to have the chance to whisper ""what's she doing here?"" to the person next to me at a funeral.",1
If everyone jumped off the docks I would too. I'm a sucker for pier pressure.,1
What's the most popular occupation in Italy? Pastatution.,1
