sentence,is_humor
What did the scientist say after attacking his colleague with sodium chloride? That's a salt!,1
Obamacare-Lite Showdown: House Vote Scheduled for Thursday - Breitbart,0
"A pirate walks into a bar... The bartender says ""Hey do you know you have a steering wheel in your pants?"" The pirate says ""Arrr... It's driving me nuts!""",1
The Transgender Straw Broke the Camel’s Back: It’s Time to Declare Independence from Public Schools,0
South Sudan plane crash: All on board survive ’miraculous’ landing,0
What's the difference between a punchline and a cute girl? Sometimes I get the punchline :(,1
I have nothing in common with people who eat 1 Pringle at a time instead of frantically shoving 20 in their mouth like it's a wood chipper .,1
Air Force officer faces investigation over Bible on his desk,0
*replies to all sexy dms with pics of my laundry pile,1
Where are average things manufactured? The satisfactory.,1
Puerto Rico’s bankruptcy hearing marks reset of asset scramble,0
Politics In Real Life: Dying From Overdose While Waiting For Treatment,0
This guy is the worst person in New York,0
"Trump Defies Turkey, Approves Heavy Weapons for Syrian Kurds - Breitbart",0
"""Mr. President, N. Korea is threatening to bomb your birthplace"" ""Why, there's nothing for them in Keny-"" ""HAWAII, sir"" ""Right, that's wh",1
"Just so u know guys I literally covered my roommates bed in 324 pieces of cornbread 2 make it a ""cornbed"" so ur fakes puns mean nothing 2 me",1
"Feather furore: T rex may not have been fluffy after all, skin study suggests",0
Explosive Opportunity A British engineer started his own business in Afghanistan. He's making landmines that look like prayer mats. He says that prophets are going through the roof.,1
7 bad science and health ideas that should die with 2016,0
Watch the moment Mark Zuckerberg found out he got into Harvard,0
"Dog keeps sighing melodramatically. I know he wants me to ask him what's wrong, but I'm not falling for it.",1
My cat passed. RIP Fluffy McMittens 2002-2003 2003-2005 2005-2007 2007-2008 2008-2011 2011-2013 2013-2014 2014-2015 2015-2016,1
How do you tell the teams apart in Amish women's basketball? It's skirts versus shins.,1
Bombing Case Points to Gaps in Trump’s and Clinton’s Antiterrorism Plans - The New York Times,0
U.S. job openings hit record high; skills mismatch rising,0
why girls prefer iphones.... because they are use to its type of Aspect ratio :D,1
 Woman Assaulted For Speaking Swahili Reads Moving Statement To Her Attacker,0
What do you call a cow with only legs on one side? Lean Beef.,1
"Almost all men with early prostate cancer survive 10 years, regardless of treatment",0
Whats the difference between me and a calendar? A calendar has dates.,1
Conor McGregor to Floyd Mayweather: ’Don’t Ever Bring Race Into My Success Again’ - Breitbart,0
"‘Gambia Is Back Again,’ but Its New Leader Is Still in Senegal - The New York Times",0
Why did hitler buy glasses? He could NOT SEE.,1
what do you call a mexican with a rubber toe? rubbertoe,1
Andrea Mitchell: Sean Spicer First Press Briefing Was ‘Substantive’ and ‘Responsive’ - Breitbart,0
"I saw a skinny guy getting brutally beat up by 5 huge guys! I'm not the hero type, but still decided to help out. It felt good being on the winning side for once.",1
With hostess shutting down... I bet Colorado is rethinking legalizing weed now...,1
Another Step Forward for National Institutes of Health Funding,0
"If you commit 90 sins, u will get caught 45 times. Why? Because Sin 90 = Cot 45!",1
The only thing better than an orgasm is being interrupted by stupid bullshit while you're masturbating. I hate stopping at toll booths!,1
5 things to know about Obamacare’s (likely) premium hikes,0
In Soviet Russia ... the Government owns the Corporations.,1
Every spiral staircase should sell a picture of you at the bottom showing how annoyed you looked walking down it.,1
"Hillary’s Advantage: She’s Boring, Not Shocking",0
I added Paul walker on Xbox He spends all his time on the dashboard,1
Q: How do you catch a unique rabbit? A: Unique up on him.,1
Why can't Micheal Bay be a farmer? Because he dosen't have a plot.,1
US aid worker kidnapped in Niger,0
What do you do when a chemist dies? You barium,1
What is the most common death among square dancers? Over Do-se-do.,1
"I, for one, support these crazy killers dressing up like clowns. It was a lot harder to see them coming when they were dressing like cops.",1
American Airlines wins $15 million in antitrust case against Sabre,0
Bronze Medallions Stolen from Indiana Veterans’ Graves - Breitbart,0
’Give them a pill’: Putin accuses US of hysteria over election hacking inquiry,0
"A Jewish boy asks his father for $20. His father says, ""Ten dollars? What do you need five dollars for?""",1
What do you call two gay Irish partners? John Fitzpatrick and Patrick Fitzjohn,1
What's a sailor's least favorite color? Maroon,1
How do fireflies start a race? Ready steady glow!,1
The dishwasher is making a strange noise. Probably because she's outside shoveling the driveway.,1
‘Clinton Cash’ Greets NATO Chiefs in Poland - Breitbart,0
Al-Qaida leader behind Islamabad hotel bomb ’killed by US drone’,0
I asked my wife if it was still necessary to get her a card for valentines day even after 5 years of marriage. She said yes and the only card she wanted was VISA.,1
Newsmax CEO: Give Jeb! a Second Look - Breitbart,0
Did you hear about the new Jewish Sports Car? It stops on a dime then picks it up.,1
"The truth will set you free. Unless Chuck Norris has you, in which case, forget it buddy!",1
Exit Britain?,0
GOPer Suggests Rolling Back Guidelines For Combating College Sexual Assault,0
Murray beats Raonic for Wimbledon title,0
I visited a small village where they had a cat for a king and a dog for a queen... ...they were reigning cats and dogs.,1
Tesla is making a risky bet with the Model 3 that could push the company over the edge,0
"Judge should've sentenced Lindsay Lohan to watch her own movies... oh wait, that's cruel & unusual punishment.",1
Cops cart off homeless man’s dumpster house — then give it back,0
I asked my North Korean friend how it's like over there.. He said he couldn't complain.,1
Free-range chickens are more likely to have parasites,0
"The Economy Grew At A Solid Pace This Summer, But Consumers Are Wary",0
"Saying your an American Jihadist... Is like saying your a little bit dead ,if your saying it you probably don't know what it is.",1
The Cardinal Trying to Save Chicago,0
The US Coast Guard busted 11 tons of cocaine being smuggled in the Pacific Ocean,0
Dick Van Dyke's real name.. Penis Van Lesbian,1
Keeping kids safe from hazardous toys,0
‘Whiskey Tango Foxtrot’ with Tina Fey is surprisingly sharp and funny,0
Choosing between Hillary and Trump is like having to fart really bad while sitting between Scarlett Johansson and The Pope. I don't know which way to lean.,1
What do you call a waterfall which causes erections? Viagra Falls,1
"""I don't get why our troops need to wear camouflage, when they could just wear glasses..."" -Superman",1
An jihidist walks into a club ...on a Tuesday...,1
Trump Supporter Drags Former Cruz Aide Into Bonkers Affair Rumor Mill On Live TV (VIDEO),0
"Loretta Lynch & Bill Clinton Meet Secretly, but Swear They’re Totally Trustworthy",0
"Krauthammer: If Trump Wins, He ’Irreversibly’ Shapes the GOP - If He Loses, GOP Civil War Begins Tomorrow - Breitbart",0
What are most incarcerated inner-city youths locked up for? Some bullshit,1
Why will the USA never go bankrupt? It will just host a telethon.,1
"""No, there's no way!"" I totally could ""No you couldn't!"" *slams the rest of his beer* I can and I will -the first guy to ride an ostrich",1
Hillary Clinton finally found her argument against Bernie Sanders,0
Why wasn't Skrillex allowed on the fishing trip? He keeps dropping the bass,1
WHO ARE YOU RUNNING FROM IN YOUR OWN APARTMENT YOU FAT MONSTER NEIGHBOR I shout to my ceiling.,1
Majority of Americans think Trump committed sexual assault,0
What do you call the pirate with the second largest penis? Long John Silver First of my original jokes to actually make my girlfriend chuckle.,1
Carlos Slim on Trump’s border wall plans: ’The best wall is investment’,0
"First joke I ever told. You know what a hypocrite is? A guy that hates cats, but loves pussy.",1
What do you call a disabled nun? Virgin mobile,1
"Iran military vessel pointed weapon at US helicopter, Pentagon officials say",0
"Restored: 5 Ways Trump, Netanyahu Improved U.S.-Israel Relations",0
I really hate when people only put one word in their submissions title,1
Always tweet as if your unfollowers are watching.,1
"Me: Hi, officer. I saw you coming up the driveway. Cop: (sadly) Your son has been in an accident. Me: I FLUSHED ALL MY DRUGS FOR THAT?!",1
This post is totally pointless circle,1
Madonna Gave a Surprise Pop-Up Concert to Support Clinton. We Were There. - The New York Times,0
"In Yemen, urgent support for survivors of deadly boat attack",0
I'm going to leave the presents out and hide my kids in the closet until Christmas.,1
"CNN 10 - January 19, 2017",0
If someone on the Windows team at Microsoft gets fired... would you say they've been defenestrated?,1
"I changed my wifi name to ""14.4k dial up connection"" so no one would bother stealing my signal.",1
Eleven Madison Park Plans a Makeover and a Summer Pop-Up - The New York Times,0
Meet the female version of Thor Whor,1
Jordan Henderson’s sumptuous strike helps Liverpool to win at Chelsea,0
"Now that even Play-Doh has an app, is real play dead?",0
Protesters briefly block Education Secretary Betsy DeVos’s visit to a D.C. school,0
Soccer ball that survived Challenger finally makes it to space,0
"Fox News Poll:  Approval of Obama up, US weaker under his leadership",0
"Did I ever tell you about how I once dated a stripper named Cake? She always used to let me have it and eat it, too.",1
"As China shops for German firms, one early example reassures",0
Q. What's te definition of a bachelor pad? A. All the house plants are dead but there's something growing in the refrigerator.,1
"6'5"" guy: [starts a fight with me at the bar] me: [hides behind GF] GF: HEY, WHAT THE F- me: look, we need more strong female lead char-",1
19 House Republicans call on their party to do something about climate change,0
"A hot girl goes to confession She says ""father, I had sex out of wedlock"" The priest says ""pics or it didn't happen""",1
Suspect under investigation in Champs-Elysees attack ,0
What's the difference between Preston Coach Terminal and a lobster with 34e breasts? One's a crusty bus station and the other is a busty crustacean.,1
[restaurant] ME: Bottle of shiraz pls. It's my birthday WAITER: Your birthday? It's on the house ME: [looking up] Do you have a ladder or,1
Cameron has washed his hands of No 10. But he’s left an almighty mess,0
Royals remember Yordano Ventura’s passion after tragedy,0
Three crows walk into a bar HL3 confirmed.,1
What did the orphan get for Christmas? Nothing.  Because he's Jewish.,1
I think I'll tell my kids that the Titanic sunk because Jack and Rose had sex before marriage.,1
"I don't delete annoying people out of my phone. I give them new names so I know not to answer. ""Always needs a favor"" is calling, decline.",1
Former Facebook Employee Compares Company Culture To A Religion - Breitbart,0
"""Seek immediate medical help if you experience a resurrection lasting more than 2000 years.""",1
"In Flint, Sanders says water crisis should serve as wake-up call",0
Don't commit suicide by jumping off a building or they might report it as a parkour accident.,1
Chew On This: Slicing Meat Helped Shape Modern Humans,0
What do you call a questionable porcine? A Porque-pine,1
"If they somehow magically ever discover another part of the reproductive system, they should name it after Prince",1
What does your mother's face and a Pillar and have in common? They're both load-bearing,1
"Before my coffee this morning, I was a flying lizard's butt . . . . . . dragon ass.",1
The U.S. made a critical mistake during Somalia’s last famine. Will we repeat it?,0
You see me wildly flailing my arms. Did I: a) Walk through a spider web? b) Try to wrap something in Saran wrap? c) Try to use Scotch tape?,1
My Penis was in the Guinness Book of World Records Then the librarian told me to take it out,1
What is Snoop Dogg's favorite restaurant? Sizzle-r,1
If I really wanted to end my life I'd probably do it by wearing a Star Trek uniform to the Star Wars Force Awakens premier.,1
The Injustice of Commuting Manning’s Sentence,0
" This Boy Was Thrown Out Of School Because Of His DNA, Parents Say",0
Can Oregano Fight Cow Belches — And Climate Change?,0
"Going to sleep: It's so cold in here, I'm totally wearing these socks to bed Middle of the night: GET THESE DEVIL FOOT GLOVES OFF ME",1
I know they're bad but ya wanna know why I love dead baby jokes? They never get old.,1
How (and Where) to Take a Tax-Refund Vacation - The New York Times,0
"What is Minecraft? It's Hitler's lesser known second book about his love of knitting. Officially the title is Mein Kraft but, the kids like this spelling more.",1
Can somebody help me debug Malaysian Flight Simulator? It keeps crashing unexpectedly :/,1
Latvian Jokes Latvian Olympian win silver medal in skeleton. Wishes silver medal was potato. Still is hungry.,1
Officials Say Trump May Not Try To Block Comey’s Senate Testimony,0
"Supreme Court Faces Volatile, Even if Not Blockbuster, Docket - The New York Times",0
What do you call a vampire that eats period blood? Count Snatchula,1
"Marriage Tip: If your husband is watching golf, show him you're interested by repeatedly asking ""why doesn't our lawn ever look that nice?""",1
Why did GG Allin leave his own concert? Shit hit the fan,1
"Breaking up with your significant other is like bowling You carry something heavy going into it, and if it goes as planned, you walk away with an X.",1
9 years ago I asked the girl of my dreams on a date. Today I asked her to marry me. She said no both times.,1
Donald Trump and Janet Yellen Look to Be on a Collision Course - The New York Times,0
"When I wake up every morning, things always go well. I'm like the optimistic amputee who always starts his day off on the right foot.",1
"Bikini season is just around the corner. Unfortunately, so is the Mexican restaurant.",1
*Orders pizza* What a night *Phone buzzes* And a text? Killing it *checks phone* ok that was the pizza confirmation but still cruising,1
If the BeeGees are 'staying alive' so much then how come they're all dead.,1
Trump Victory Sends Small Business Optimism Skyrocketing - Breitbart,0
"I saw a billboard on the way to work this morning that read ""Future Events."" Well, that's a sign of things to come.",1
What do you call an octopus that fights sharks? An octobrave. I'm sorry.,1
"If Hillary Had Been a Soldier in the Army, Here’s How She’d Be Treated",0
I would think you'd have to be open minded... ...to be a brain surgeon.,1
"How many McDonalds workers does it take to change a lightbulb? None, because they can't climb the ladder.",1
"How high are you? Cop  How high are you? Me  No, you are wrong. Its Hi, how are you?",1
What do you call a Trump-supporting midget having a seizure? A Foul Munchkin Malfunction,1
One out of five dentists has the courage to speak their own mind,1
"I gave two pints of blood at the hospital. You would think they'd appreciate it but they just started asking me questions like... Who's blood is this, and how did you get it?",1
My boss told me not to bring my lunch to work in a brown paper bag. I told him that I'll drink my lunch how I want.,1
I cut off He-Man's electricity today. Now I have the power.,1
Trump’s Wiretapping Claims Puncture Veneer of Presidential Civility - The New York Times,0
You don't realize how much you miss someone until they come back from the dead.,1
I came across a lost kid in my neighborhood the other day Now I have to register everywhere I live and put a sign in my yard :(,1
What do Welshmen call a sheep dog in Wales? Their Pimp,1
Why doesn't Kirk like to have one-night stands? Because the girls always cling on him afterwards.,1
How many punks does it take to change a light bulb? None. Punks never changed anything.,1
China Observes Ramadan by Praising Itself for ’Religious Freedom’ in Muslim Xinjiang,0
Did you hear about the man who got sick at the airport? It was a terminal illness.,1
My doctor told me not to lift anything heavy So now I have to sit down to pee.,1
"""daddy why did the moon turn red?"" ""because god is flooding it with the blood of all the children who ask too many questions sweetie""",1
"While playing the depressing part of a videogame, my close pal Xavier suddenly starts massaging my crotch I've never been so touched on an emotional level.",1
What the the planet Jupiter say to Neptune? I can see Uranus from here.,1
I bet you 5390.24$ you can't guess how much money I owe my parents.,1
"Facebook ‘raptured’ a bunch of users, telling many that they were dead",0
Israel Minister: Kerry’s Planned Last-Ditch Mideast Policy Speech Is ‘Pathetic’,0
"Liver Doctor: You are in trouble, your liver is enlarged Patient: Does that mean I have more space for whisky now?",1
"I was so happy when I got my new thesaurus in the mail. But when I opened it, every page was blank! Damn. I have no words to describe how upset I am.",1
Why did the tree install solar panels? It wanted to be a power plant.,1
Astronomers Just Found a Mega-Planet With Three Suns,0
"""WHAT DO WE WANT?"" i havent decided yet ""WHEN DO WE WANT IT?"" i still need a few more mins with the menu you are a really terrible waiter",1
"People are like snowflakes. When they pile up on my car windshield, it's difficult to drive.",1
What's the best blood type? Blood that is circulating.,1
US Military Using Floppy Disks For Nuclear Operations - Breitbart,0
Woman says she got knocked out during ‘Sleep No More’,0
"What did Robin Williams suicide note say? ""Sorry guys...I gotta go see about a girl.""",1
"Too Much Stigma, Not Enough Persuasion",0
Ted Cruz Calls For Oregon Protesters To ’Stand Down’ - Breitbart,0
"More needed against ‘insider threat’ at airports, report says",0
"If you need me, I'll be in the bathroom I guess it's finally time to shave my legs for spring *Walks away with hedge trimmers",1
The Gay-Rights State That Took Years to Protect Transgender Citizens,0
"Flint, Michigan’s water crisis has still left the city with fewer poisoned children than Detroit",0
Why is the O in Opossum silent? Because it's playing dead.,1
"Everyone is saying 9/11 was a joke, it wasn't. It's a social experiment.",1
Wall Street ticks up as hawkish Fed fears ebb; Apple weighs,0
How does Trent Reznor's mom hang up his Christmas stocking? With a Nine Inch Nail.,1
My grandmother started walking five miles a day when she was sixty. She's ninety-three today and we don't know where the hell she is.,1
tilt your head up as in like look up at the sky and squeeze the bridge of your nose and blink alot. it prevents crying u wimp,1
Why did the kidnapped clock always read 12:00? His hands were tied.,1
Man dies after brutal beatdown,0
Charlie And The Chocolate Factory is my favourite book about a weird guy who murders four children then convinces another to live with him.,1
Trump wants to make America more like Denmark,0
My New Year's resolution is to save enough to buy a Velcro wall. And I plan on sticking to it.,1
"Was out on the golf course and shot an eagle at Hole 9. Mom doesn't believe me, but wait till she sees the eagle.",1
"The economy isn’t going to do what Trump wants, banks say",0
"From Duke To The Dead, Ralph J. Gleason Loved It All",0
Jewish pedophile what did the Jewish pedophile say to the kid walking down the street? Hey kid wanna buy some candy?,1
"Someone refine this joke if it's needed. Ay girl, I heard you like wearing food. Do you know where I can get jalapeno panties?",1
"The key to success is sincerity... Once you can fake that, you're golden.",1
What do delinquent shapes get up to? Shenanigons,1
This court case will decide if Obama’s signature climate policy goes down in flames,0
I saw a Prius crash into a Subaru Outback the other day... There was granola everywhere.,1
"Does Hilary's scandal compare to Bill's? I'd say it's close, but no cigar.",1
What do you call a neurotic octopus?  A crazy mixed-up squid.,1
"If an opinion is worth 2 cents, how many cents is an argument worth? It really just depends on how much cents it makes.",1
I wanted to have a blimp of my own But it is so above my reach due to all the inflation!,1
Turkey coup attempt: Reaction on the streets of Istanbul ,0
What is a guy with ED favorite saying? I'm going to PUMP YOU UP!,1
"Trump is still #1 in Polls after the Republican Debate Oh wait, wrong sub-forum.",1
"When anyone says they've embarrassed themselves enough for one day, I smile, nod and think 'that kind of limit sounds nice'",1
My girlfriend started smoking... ...so I slowed down and applied lubricant.,1
EXCLUSIVE: Trump Has ’Less Kinetic’ Option in Afghanistan,0
The Russian ’Traitors’ Competing in the Olympics ,0
Bit creepy of my maths teacher to put a little kiss after each answer.,1
Siouxsie Sioux at 60: more than a monochrome goth-pop priestess,0
"As I stood under the running water in the shower I couldn't help but think of those poor, thirsty kids in Africa. It made me cum faster.",1
Obama Wishes Jews ’Happy Hanukkah’ -- as He Stabs Israel at UN,0
How do I make my penis 12 inches long? By folding it in half.,1
Knock knock! Who's there? It's me.,1
"SNAKES, TANKS, AND PRANKS: This 27-year-old college drop-out travels the world turning other people into YouTube and Instagram stars",0
"What did the pilot say when his plane wasn't flying? ""Aw man, that's a drag.""",1
American Apparel making goods outside US for first time,0
 Debbie Reynolds Dies One Day After Daughter Carrie Fisher,0
"A superconductor walks into a bar. The bartender says, ""Get out! We don't serve your kind here."" The superconductor left without resistance.",1
"Blood is thicker than water, but maple syrup is thicker than blood. So pancakes are more important than family. There, I said it.",1
I really hope Trump gets elected... Since i've never seen a president get assassinated before.,1
"How does Bono spell ""color""? With or without ""u""",1
Tom Hanks: ’Self-Involved Gasbag’ Trump Will Never Be President,0
"Super-rich private equity stars rue ’lousy’ reputation, say they are misunderstood",0
Why doesn't Thor of the insect world use a hammer? He's already got a Thor Axe.,1
People are entranced by next-level bird lover’s ‘pigeon shoes’,0
"Lax gun policies may be linked to stolen firearms in US, study finds",0
"Syria’s cease-fire is working, at least for now",0
Scalise Completes Third Surgery As Authorities Track Shooter’s Past,0
Donald Trump: Fox News Statement ’Disgrace To Good Broadcasting And Journalism’ - Breitbart,0
"I introduced my girlfriend to the family Me: hello everyone, meet Jasmine Jasmine: Hi Wife: what the fuck",1
My hand is stuck in a jar of salsa right now. I'm just gonna leave it in there. This is who I am now. I'm tired of fighting.,1
The Strange Career of Free Exercise,0
knock knock Who's there? Pill. Pill who? Pill Cosby.,1
"I recently surveyed 100 women about their favorite shampoo preferences... The number one answer was, ""What the hell are you doing in my bathroom!?""",1
"OK, guy with the two kayaks and two bikes strapped to his Subaru Outback: settle down. Save some outdoors for the rest of us.",1
"Myanmar must work to close Rohingya camps, says Kofi Annan panel",0
Trump’s chief economic adviser just made an embarrassing admission,0
Conservatives for Trump?,0
"A teenage boy asks his granny: 'Have you seen my pills, they are labelled LSD? Granny: ""Fuck the pills; have you seen the dragons in the kitchen?""",1
Why don't blind people go skydiving? It scares the hell out of the dog.,1
What did the doctor say to the Fonz when he got sick? You need to take your vitamin Ayy.,1
Matthews: ’Beyond Indecent’ And ’Over the Line’ To Say Hillary’s An Enabler of Bill’s - Breitbart,0
Why is blackmail called blackmail? Because it isn't fair.,1
What's the difference between a woman and a washing machine? A washing machine won't follow you around after you dump your load in it.,1
What is a Jew's favorite Mexican food? Carne Masada,1
Whos the funniest disney princess? raPUNzel *sits there laughing to self* ...so lonely..,1
"Blacksmith asked, do you have any experience in horseshoeing? ""Yes, I once told a horse to fuck off.""",1
I use so many age defying crinkle creams that I don't have finger prints anymore.,1
"If you love someone just tell them. Or get drunk and text them 75 times, that's practically the same thing.",1
"My son was thrown out of school today for letting a girl in his class wank him off. I said "" son thats 3 schools this year, maybe teaching isn't for you""",1
Airstrike in east Aleppo hits funeral,0
"How do you kill bread? Bake it for a little while, and it will be toast.",1
You guys wanna hear a dirty story..... A horse fell in the mud.,1
Gay Catholic Groups Want Pope Francis to Do More Than Apologize - The New York Times,0
You know what's the saddest part of North Korea getting hacked? It won't get to see this.,1
I gave my wife my email address but she keeps on speaking directly to me.,1
Lil Wayne says Black Lives Matter has ’nothing to do with me’,0
