sentence,is_humor
Clinton ’relentless’ in attacking Trump’s business record,0
"A horse walks into a bar... ""Why the long face?"" asks the bartender... The horse replies, ""I can no longer make ends meet based solely on the royalties from Sex in the City.""",1
So a wizard was walking down the street... Then he turned into a driveway.,1
"What does a white man never want to call a black man that starts with ""N"" and ends with ""R""? Neighbor",1
Where Does Your Member Of Congress Stand On Trump’s Immigration Order?,0
What does an eighty year old woman have in between her boobs that a twenty year old woman doesn't? A belly button.,1
Sure glad I filled my iPod with shit that I hate.,1
What do you call a chicken with political ambition? Republic-hen,1
Wiping your ass is a lot like approaching a traffic light... Red means stop.,1
"Parent obesity may affect child development, study says",0
The only food in Hell is the part of the popcorn kernel that gets stuck between your teeth. Also they have an Olive Garden.,1
"ProPublica: As ISIS Brewed in Iraq, Clinton’s State Department Cut Eyes and Ears on the Ground - Breitbart",0
Why are gay people so rude ? Because they're fucking assholes !,1
"Erick Erickson: I’m gonna give Trump a chance (no, I’m not a sellout)",0
Mom spotted bomber moments before concert attack,0
What did one cloud of fog say to the other? I don't know. It's a Mistery.,1
I only trust people that like big butts. ...they can not lie.,1
What goes eek eek bang? A mouse in a minefield !,1
A woman claims she was denied an abortion while in jail. Now she’s suing for $1.5 million.,0
Q: What did the leper say to the hooker? A: Keep the tip.,1
Yo mama so fat She is overweighted,1
Face tattoos are a great way to let people know that you don't owe on any student loans.,1
Why are men like paper cups? They're disposable,1
Coworker: I like working with you. I feel like I can really talk to you Me: I'm sorry I gave you that impression. That's not correct,1
Q- How many billionaires does it take to make Batman A- Three. Two to die and one to never get over it. I heard this in the game Arkham Knight,1
"The espresso bar tech visited today... They adjusted my grind, turned up the heat, and blew out my steam wand.",1
Novak Djokovic Loses to Sam Querrey in Third Round of Wimbledon - The New York Times,0
"I always keep a google search for ""how to find anyone, anywhere, and kill them"" open on my phone in case anyone steals it.",1
"""Did you bring your LIST?"" -Everyone who sees Craig at the supermarket, probably",1
"Umm, no officer. I'm pretty sure that bag of weed fell out of YOUR pocket.",1
Joke challenge What's the best mad scientist joke?,1
"200 Catholics, one cup. -Mass",1
Attack will empower Europe’s far right (Opinion),0
What do you get when you drop a piano on an army base? A flat major.,1
The Egyptian Army has shared the first photos of wreckage from the crashed EgyptAir flight,0
No thanks farting robot on the wall I'll use the paper towels to dry my hands nice try though,1
BlackBerry kills off Classic smartphone — again,0
What do you tell a metal head who's walking on an icy street? Slip not.,1
Why is the Canadian school system broken because they only give out ehs,1
"Chelsea Manning starts hunger strike, saying she is bullied in prison",0
Gawker.com to shut down next week after acquisition by Univision,0
"Where do you see yourself in four years? I don't know, I don't have 2020 vision.",1
Thailand: police charge eight-year-olds with obstruction in run-up to referendum,0
The Big Question: Reader Poll,0
What's Fozzy Bear's favorite city? Mil-wocka-wocka-waukee,1
Bought a new Shakespeare sat-nav - It gets me from A to B or not to B.,1
[police interrogation room] Officer: you've been identified as the runner who.. Me: Let me stop you right there.,1
Have you tried locking him in your trunk?,1
"why does beyonce sing to the left, to the left? because black people have no rights XD",1
Trump: ’Devastating’ State Dept. Report Shows Hillary Has ‘Bad Judgement’ - Breitbart,0
I just saved a bundle on future college tuition by finding out my 4 year old wants to be a gum ball when he grows up.,1
Why can't Kimbo Slice beat Mike Tyson? Because he's dead.,1
I recently bumped into a Frenchman wearing a bagel as a scarf. He said it was a real pain in the neck.,1
Sorry in advance Why did Helen Keller dog kill itself? You would to if your name was aaaaaaaauuuuggggfdddshnvxxkjkuuokkgdsgj,1
House Democrats Take a Milder Approach on Gun Control,0
If your partner/spouse tells you they're not reading everything you tweet: A) they're lying B) hi honey!,1
"Sperm 1: ""Geez I'm exhausted, how much further to the Fallopian tubes?"" Sperm 2: ""A long way, we've just passed the tonsils...""",1
The ‘Evil Political Operator’ at the Anger Games,0
Police Org: Obama is ’Neville Chamberlain’ in War on Cops,0
"Steve Harvey said he doesn’t apologize for his brutal staff rules, which include ’do not attempt to walk with me’ and ’do not wait in any hallway to speak to me’",0
Ex-CIA chief says Trump risks blame for an attack if he skips briefings,0
What is the difference between 'light' and 'hard'? I can sleep with a light on.,1
"There was an explosion at a toy factory... Only 1 injury reported. A security guard had plastic horses lodged in his rectum. Doctors say he is in ""stable"" condition.",1
Picture me and my boyfriend on a dinner date Wrong We're sitting on the same side of the table making you uncomfortable,1
A Singer’s Journey: From Solitary Confinement to the Met Opera - The New York Times,0
Porn is so unrealistic. There's no way a guy with a ponytail could have a house that nice.,1
"Waitress dad jokes When waitress comes to the table ask if she takes orders ,""to go""? If she says yes respond with, ""Great! Get your purse we're leaving.""",1
Scientist: But WHY is the bee population dying? Scientist: No idea. *eats bee* Scientist: Did you just eat a bee? Scientist: *eats bee* No.,1
*Hands you a handbasket* You know what to do.......,1
Trump invites Russia to meddle in the U.S. presidential race with Clintonâ€™s emails,0
How do you sink a submarine full of blondes? Knock on the door.,1
‘What’s your end game?’ Trump delegating Afghan war decisions to the Pentagon faces scrutiny,0
Macedonia’s election commission orders re-run in one polling station,0
How did Jared Fogle lose so much weight? because he chose from the kids menu,1
"Scientists To Bid A Bittersweet Farewell To Rosetta, The Comet Chaser",0
What is the opposite of an autistic? A Socialist.,1
Portrait of ’real’ Mr Darcy unlikely to set 21st century hearts aflutter,0
I stuffed my mom last night. I know you're thinking I have an Oedipus complex and that's gross but jokes on you I'm a taxidermist,1
I went to my doctor. He said I was overweight. I said I want a second opinion. He said you're ugly too.,1
How Atheists and Agnostics Let Christians Dominate Congress,0
Nordstrom’s comparable sales miss deepens department-store gloom,0
What's the official sports drink of the KKK? White Power-ade,1
I finally made something of myself It's a wad of hair and ear wax and snot sitting in the garbage can.,1
"Chuck Norris was bitten by a snake After several day of agonising pain, the snake finally died.",1
"Just saw a billboard that said, ""Texting & Driving Is Dangerous!"" Hahaha... that's so lamOMG I JUST HIT A CIRCUS ELEPHANT!!!",1
What do you call a group of babies? an Infantry,1
"Just bought a Ken doll. I don't know what everyone's talking about, you can't read books on this thing.",1
Just stirred my coffee with a fork if any of you guys are looking for a new bad boy to join your crew.,1
Still super weird to me that humans can make other smaller humans. I wish mozzarella sticks could make other smaller mozzarella sticks.,1
Family’s quest for truth reveals top insurer’s link to SS death camps,0
Have you heard about the corduroy pillows They were so famous they made headlines.,1
Donald Trump to Meet with Sheriff David Clarke as He Plans Administration - Breitbart,0
Whats the best thing about having sex with a pregnant woman? You get pussy and head at the same time.,1
Live! From New York! It’s Monday Night! And Possibly The Most-Watched Debate,0
Why have sumo wrestlers began shaving their legs? They were getting tired of being mistaken for feminists,1
Marco Rubio’s Record of Misjudgment,0
What brand toothbrush do Mexicans use? Oral-E,1
Jay Clayton sworn in as chairman of the U.S. SEC,0
"GARY JOHNSON: let me debate, i wanna debate, lemme lemme MODERATOR: FINE! how will you deal with big banks JOHNSON: like...river banks, or",1
"The day after Thanksgiving is often the biggest capitalist/materialistic shopping day every year. I'm protesting it this year, and had to think of the movement's slogan... Black Fridays Matter.",1
Safety Regulator Looks At Alleged Tesla Suspension Flaw,0
Why did the little girl fall off the swing? She didn't have any arms!!,1
What's better than a tall woman wrapping her legs around you? A short woman trying like hell.,1
How do you measure a snake? In inches. Snakes don't have any feet.,1
"How many feminists does it take to change a lightbulb? None, because they can't climb the social ladder.",1
Accidentally got two shots of hand sanitizer so if you need me I'll be rubbing my hands together for the rest of my life.,1
White House Won’t Commit to Stripping Bill Cosby’s Presidential Medal of Freedom - Breitbart,0
inncocent child,1
What's the difference between a dirty bus terminal and a large-breasted crab? One's a crusty bus station and the other is a busty crustacean.,1
Real-life ‘Fault in Our Stars’ couple dies days apart,0
What kind of shoes do ninjas wear? Sneakers.,1
"Tens of thousands of Syrians trapped in ISIS fight, many starving, UN warns",0
"Two scientists walk into a bar The first one says ""I'd like a beer"" And the second says, ""I'd like rum"" They didn't wanna get H20. They were in flint.",1
Which painter always had a very bad cold?  Vincent Van Cough,1
"At 82, Emperor Akihito of Japan Wants to Retire. Will Japan Let Him? - The New York Times",0
What's it called when you try not to get knocked unconscious by a Taser? Resisting a rest.,1
What kind of dog is best at keeping secrets? hush puppies,1
Look me in the eyes when I'm lying to you.,1
Why does lightning only strike the French? Because it follows the path of least resistance,1
Jordan Spieth hit 2 straight shots into the water to lose the Masters,0
Hillary’s Hyde Amendment Horror,0
Kashmir: Why is Modi going on the offensive now?,0
What do you call a sandstorm that won't go away? Da rude sandstorm,1
Children in the backseat can cause accidents. Accidents in the backseat can cause children.,1
"All this month when a waitress asks me how I'd like my eggs, I'll tell her to nog that shit.",1
Why did Tiger Woods stop designing golf courses? He couldn't keep it down to 18 holes.,1
"BREAKING NEWS: NASA announces Mars Rover discovered new feline-like life form on the Red Planet Unfortunately, it ran over the newly discovered creature. Yes, it seems Curiosity killed the cat.",1
Opportunity rover celebrates marathon milestone,0
My girlfriend said she was leaving me because I never pay attention ...or something like that... I wasn't really listening.,1
’For Honor’ 360° Trailer: In the Heart of Battle - Breitbart,0
Showtime’s Financial Drama ’Billions’ Doubles Down On Melodrama And Machismo,0
Weird how the guys who say that don't see race always know the black-on-black crime statistics.,1
"If you love something, let it go. From the creators of ""If you're tired, go for a run,"" and ""If you're on fire, eat bees""",1
Meet Mike Pence’s chief adviser: Karen Pence,0
How many feminists does it take to change a lightbulb? - That's not funny,1
Girl are you a University of Phoenix degree because I'm pursuing you online and from my couch,1
I used to be a plastic surgeon. That raised a few eyebrows...,1
All the girls I've ever kissed can agree on one thing. It's weird that I have a beak.,1
Why A Vote For An Establishment Candidate Could Be A Vote For Trump In N.H.,0
Sharing a Facebook account with your gf/wife is the best way to let everyone know how whipped you are.,1
I spent 20 minutes at the gym trying to untangle my headphones...I'm done..my arms are killing me!,1
Calling your girlfriend dumbledore cz she is the real head master,1
Q: How many Englishmen does it take to screw in  a light bulb? A: What do you mean change it? It's a perfectly good bloody bulb! We have had it for a thousand years and it has worked just *fine*.,1
I asked Kanye West if he'd seen Inception & he opened the locket around his neck revealing a photo of me asking him of he'd seen Inception.,1
"What to do with a child soldier lower your aim. someone i met who is in the army told me this is what his sergeant told them, he didnt intend it as a joke.",1
The ‘hollowing’ of the middle class?,0
I thought I fell in love with my blender ...but now I have mixed feelings,1
"In divided Turkey, president defends victory in referendum granting new powers",0
So you have better sunblock than me... Rub it in,1
I don't get how people say Mickey Rourke looks bad for his age... ...don't they realise his first film role was in 1941?!,1
"5-year-old: I can't finish my lunch. I don't feel good. Me: OK, then no ice cream. 5-year-old: I'm sick, not dead.",1
Future Contains Multitudes,0
Original plans for Mt Rushmore had the mouths carved open so they would scream out bats at the setting sun then eat them again at dawn.,1
"Paper: Alex Soros Enlists Pros to Practice Photo Poses, Procure Women - Breitbart",0
When Martin Cooper invened the cell phone... ... he already got 3 missed calls from Chuck Norris.,1
"Pickup line Hey there, wanna come over and watch porn on my 50 inch flat-screen mirror?",1
How do you titillate an ocelot? You oscillate it's tits a lot,1
"Donald Trump, Obama, Thanksgiving: Your Weekend Briefing - The New York Times",0
My dog just ate a butterfly and probably saved Tokyo from a tidal wave. I don't understand science.,1
"Women are like snorkels... They can go down, but occasionally need to come up for air.",1
When does a Cub Scout become a Boy Scout? When he eats his first Brownie.?,1
COP: Do you know why I pulled you over? ME: I'm not sure. Over.,1
"Bill Cosby's new t.v. show premier's next month, ""Rape Victims Say the Darndest Things!""",1
I have the Quran on CD... People sure are getting upset when I said I burned it.,1
Chief Justice John Roberts Lauds Federal District Judges In Year-End Report,0
Why did Bin Laden listen to Eminem? He was an Afghani-Stan.,1
Giuliani: Ted Cruz Owes New York an Apology - Breitbart,0
The Orgasm Time Machine A coming of age story.,1
I'm having a hard time trying to decide on which pencil to use for my English literature exam. 2B or not 2B - that is the question.,1
"I really hate the word ""subcutaneous."" Idk, for some reason it just gets under my skin.",1
How does one become an Astronaut? Dip your anus in nutella. Hahahahaha :'),1
Iran could decide fate of first global oil deal for 15 years,0
Me: A coworker called me 'Papa Hemingway' today. Her: Because of your beard? Me: Well it wasn't because of my Nobel in Literature.,1
Friend or food? China’s ’civil war’ over dogs,0
 Pregnant Women With Herpes May Be More Likely To Have Kids With Autism,0
Investigators continue to probe Central Park blast that injured Va. teen,0
Why do apes climb to the tops of buildings? The elevator men are on strike!,1
What do you call a multiple choice dad joke? A pop quiz.,1
What did Putin say after listening to the West whine about the invasion of Ukraine Crimea river baby,1
twitter might remove the 140 character limit so i'm putting some 800 word tweets with character development & plot twists in my drafts,1
"I've lost my boyfriend! He's in one of these browser tabs, somewhere.",1
Google’s Satellite Map Gets a 700-Trillion-Pixel Makeover,0
"French election could bring a jolt to Western security, no matter who wins",0
Panetta: Trump Has No Details on ’What The Hell He’s Talking About’ - Breitbart,0
"Nothing terrifies me more than hearing, ""Mommy close your eyes I have a present.""",1
Why did the chicken run out into traffic? To get to the other side.,1
Why doesn't a chicken wear pants? Because its pecker is on its head. That was on South Park last night and made me lose it.,1
"How my dad taught me how to button my suit coats. He said *""Think of it like a woman; sometimes the top, always the middle, but never the bottom.""*",1
"Some vampires went to see Dracula. They said ""Drac we want to open a zoo. Have you got any advice?"" ""Yes"" replied Dracula ""have lots of giraffes.""",1
Donald Trump is right: The Republican nominating process is a scam,0
Saks Fifth Avenue gets a makeover,0
What kind of food can you color with? A cranberry! ~ Esher (my Grandson) age 5,1
Why do parents feel the need to hold your phone when you show them a picture?,1
"Your smile must be a black hole, nothing can escape its pull.",1
"Man arrested for shooting rampage that left 5 dead, spanned 200 miles",0
What happened to the chicken who crossed the road.. Got hit by a bus.,1
My coworkers think it's funny they have power & I don't. I think it's funny how they won't get home to enjoy it cuz their tires are slashed.,1
Bin Laden called for Americans to rise up over climate change,0
10 Famous People Who Praised Venezuela’s Descent Into Socialist Hell - Breitbart,0
Us Weekly with Ivanka on cover sells 200K newsstand copies,0
"Apple will release new iPad models, but will anyone care?",0
Once all serial killers decided to compete for the most kills It was a cut throat competition,1
There are many effective ways of inviting me to your event but doing it on Facebook is definitely not one of them.,1
Marries a mime. Lives quietly ever after.,1
"Why did the german die from his injuries Because when his friend asked if there is a number to call incase of emergencies like this, he replied ""999"".",1
"Sanders meets with Obama, says president will remain neutral in primary race",0
Q: What's the differents between Bill Clinton and an elephant? A: About 20 pounds and a jogging suit.,1
How do you call a play on numbers? A pin.,1
I found out something today. You should always stay happy because 'sad' spelled backwards is das. Andd.... das not good.,1
post and comment hey nice jokes,1
Native American groups take oil pipeline protests to White House,0
That kid didn't really find a lost Mayan city. The sites that promoted the story? I guess they'll issue a... Maya culpa.,1
"Im not saying I'm number one, uh sorry I lied I'm number one two three four and five.",1
Joke Did you hear about the man who stoke a bed,1
Apple enters self-driving car race,0
You could be flying nonstop to Cuba from the US this fall,0
The bonfire of Noam Chomsky: journalist Tom Wolfe targets the acclaimed linguist,0
"[gestures to the parents of a crying baby] shhhh, please. my foot's asleep",1
Why does 71 like 68? Because 68 69 70.,1
How many Vietnam vets does it take to change a light bulb? YOU DON'T KNOW!!! YOU WEREN'T THERE!!!!,1
Best Black Friday Deal Trump selling out all his supporters at 70% off,1
Why did the Italian miss his dinner? It'a was'a pasta his bed time,1
Anatomy of a Media Conspiracy - The New York Times,0
Do You Know More About Health Than Donald Trump?,0
"Rodman, Rogen and Jong-un walk into a bar...(add your punchline because I don't have un!)",1
I'm not afraid of dying. I'm afraid of ending up in a nursing home with a roommate who has Justin Bieber posters and Twilight shirts.,1
Central Banks Worry About Engaging World Markets After ‘Brexit’ - The New York Times,0
’I live both those lives’: Black officer’s emotional response to Dallas ,0
What did the redditor say to the repost? Upvote!,1
I'm really good at managing my credit card... ...My bank keeps sending me letters saying my account is outstanding.,1
GOP Rep. Faces Pressure To Condemn Trump At New Jersey Town Hall,0
Me: We should go to the gym more often. Him: I hate it there. It's like a meat market. And I'm the expired meat.,1
I need to pluck my eyebrows before they cast Eugene Levy to play me in the movie of my life.,1
"What do you call it when three french cats get into a boat only meant for two? Un, deux, trois, quatre, cinq!",1
Brazilian President Dilma Rousseff ousted in impeachment vote,0
"Rumor has it, that if you look up from your phone you can see all kinds of pretty colors in the trees this time of year.",1
Hillary’s Leaked Memo Accuses Saudi Arabia and Qatar of Supporting Terror Groups,0
A Freudian Slip A Freudian slip is when you say one thing but mean your mother,1
The Wicked + The Divine is a comic book love letter to David Bowie,0
Pandering to fear,0
God I'm glad chicken breasts don't have nipples.,1
If kids get their mouths washed out with soap for saying naughty words are we supposed to wash their hands for typing them?,1
"A paedophile, a sadist, and a Priest walk into a bar. He sits down and orders a drink.",1
"A vegan, an atheist, and a crossfitter walk into a bar... I only know because they told everybody",1
How do you get a Mormon to stop drinking all your booze? You invite two of them.,1
"Watch: Hillary Clinton’s open, heartfelt response on God and prayer",0
"""Daddy, where do babies come from?"" From mommies. ""How do they get inside?"" CAN'T U ASK WHY THE SKY IS BLUE HAVEN'T U WONDERED ABOUT THAT",1
Gay jokes are not funny Cum on guys....,1
"Tattoos are a nice way to forever honor loved ones, like family members who have passed away, or skulls with bat wings that have passed away",1
"*I* actually went through with a threesome. There were a couple of no shows, but I still had a good time.",1
"Actually, the U.S. Will Pay for the THAAD Anti-Missile System",0
"Good Friday: Obamas Join Winfrey, Springsteen, Hanks on David Geffen’s Yacht",0
This terrible date had too many red flags to count,0
"How many Sanders supporters does it take to change a light bulb? Trick question, they can't change anything.",1
"Tim Tebow Will Attempt Another Comeback, This Time in Baseball - The New York Times",0
Who's this moderation person everyone tells me to drink with?,1
"So my dad was all ""stop eating my pills"" and then I was like ""stop melting into the floor and spinning multi colored webs you talking lamp""",1
Did you hear about the support group for people who talk too much? It's On &amp; On Anon.,1
Gregg Jarrett:  Four things to know about Obama’s immigration plan and the Supreme Court,0
What do you get a man who has everything? storage,1
"Dozens Of Headstones Broken, Overturned At Jewish Cemetery In PA",0
What would an employee only entrance to a brothel be called in Westeros? A Hodor...,1
"If a single stick is called a ""fag"", and a bundle of ""fags"" is called a ""faggot"", then what do you call a group of ""faggots""? A ""subreddit""",1
"It's like my nana always said, ""If you choose your friends wisely, you'll never have good drugs.""",1
What do you call a group of grandmothers making out with each other? A bunch of bi Nanas.,1
"A Cop, Indian, GI, Construction Worker and a Cowboy walk into a bar... Am I in the wrong place or are they?",1
What is a crevice that is owned by someone and not allowed to be stepped into? None of your abyss-ness,1
LINCOLN: Better to remain silent and be thought a fool than to speak and to remove all doubt. TWITTER: No.,1
If you think colours aren't funny then you lack a sense of hue-mour,1
"Everyone saying ""Poor Steve Nash, he got hurt again"". POOR? That boy making $9,701,000 this year. If he poor, then I'm skinny.",1
The Costs of Financial Isolation,0
What do you call a dinosaur with an extensive vocabulary? A Thesaurus.,1
They say that American beer is like having sex on a canoe. It's fucking close to water.,1
George Mason University Firms Up Plan to Name Law School for Scalia - The New York Times,0
I used to love correcting people's grammar until I realized what I loved more was having friends.,1
"Winter must be the happiest woman on Earth Watching ""Game of Thrones"" made me realize that Winter must be the happiest woman on Earth. She is always coming...",1
"My parents just said they want another child. ""I'd love a sibling!"" I said. ""That's not what we meant."" they replied.",1
 These Deliciously Delicate Chocolates Are Making History,0
"Types of people There are 10 types of people in this world. Those who know binary, and those who don't, and those who weren't expecting a base-3 joke.",1
Playing truant from school is like a credit card Fun now pay later !,1
"She said ""Give me 10 inches and make it hurt."" (NSFWish) So I fucked her twice and slapped her.",1
Moody’s: California Least Prepared for Next Recession - Breitbart,0
"""I NEVER have enough pockets to carry all my awesome cargo!"" - revolutionary shorts designer.",1
A Harsh New Reality May Await El Chapo in Colorado’s Supermax Prison - Breitbart,0
Donald Trump: Hillary Clinton Lacks ’Mental and Physical Stamina’ to Fight Islamic State - Breitbart,0
"How many people wrote ""anti-oepidus"" 1 3/5",1
Thousands Line Highways to Honor Slain New Mexico Cop,0
Want to watch a new football league? Try Mexico’s popular and exciting Liga MX,0
"How many cross-dressers live near Manchester? Well, nearly 320,000 people round there have a Wigan address.",1
Bernie Sanders Triumphs In Hawaii Caucus,0
The New Key to Immigration Reform: More High-Skilled Immigrants,0
"Damn, girl... Are you a Pokemon? Cause I wanna make your vulva sore.",1
